{
  "plugin": {
    "title": "Перегляд статей",
    "description": "Виведення списків статей та окремих статей на сайті."
  },
  "settings": {
    "result_page": {
      "title": "Сторінка результатів пошуку й тегів",
      "description": "Сторінка для виведення списку статей."
    },
    "article_page": {
      "title": "Сторінка окремої статті",
      "description": "Сторінка для виведення окремої статті."
    },
    "search_plugin": {
      "title": "Плагін пошуку й фільтрування",
      "description": "Плагін, який забезпечує фільтри та результати пошуку."
    }
  },
  "handlers": {
    "view": {
      "title": "Виведення статей",
      "actions": {
        "list": {
          "title": "Список статей"
        },
        "view": {
          "title": "Окрема стаття"
        }
      }
    },
    "manage": {
      "title": "Керування статтями",
      "actions": {
        "config": {
          "title": "Налаштування статей"
        },
        "list": {
          "title": "Список статей"
        },
        "edit": {
          "title": "Редагувати статтю"
        },
        "save": {
          "title": "Зберегти статтю"
        },
        "delete": {
          "title": "Видалити статтю"
        }
      }
    }
  },
  "phrases": {
    "articles": "Статті",
    "latest_articles": "Останні статті",
    "read_more": "Читати далі",
    "published_at": "Опубліковано",
    "updated_at": "Оновлено",
    "authors": "Автори",
    "tags": "Теги",
    "no_articles": "Статей не знайдено.",
    "back_to_articles": "Назад до статей",
    "items_per_page": "На сторінці",
    "all": "Усі"
  }
}
